{
  "run_id": "ablation_no_contr_loto_holdout_overwrite",
  "created_utc": "2026-02-16T13:10:35+00:00",
  "command": "E:\\Research\\cachemedic_pp_harness_v1_1\\cachemedic_pp_harness\\empty_dirs_for_codex\\src\\cachemedicpp\\sweep.py --sweep_config configs/fast_paper_sweep_core.yaml --out_root empty_dirs_for_codex/outputs/runs_fast_paper_core --resume",
  "config_path": "E:/Research/cachemedic_pp_harness_v1_1/cachemedic_pp_harness/empty_dirs_for_codex/outputs/runs_fast_paper_core/fast_paper_sweep_core_v1/ablation_no_contr_loto_holdout_overwrite/sweep_resolved_config.yaml",
  "config_hash": "80a465de321e1bc6537263f88076a1db7926fe965b12f6b8c4717593cda6a657",
  "git": {
    "commit": "unknown",
    "dirty": false
  },
  "env": {
    "python": "3.12.10",
    "torch": "2.9.1+cu128",
    "transformers": "4.57.3",
    "cuda": "12.8",
    "gpu_name": "NVIDIA RTX PRO 6000 Blackwell Workstation Edition"
  }
}
