{
  "run_id": "main_contr_vonly_tuned_loto_overwrite_lambda5",
  "created_utc": "2026-02-16T22:02:32+00:00",
  "command": "E:\\Research\\cachemedic_pp_harness_v1_1\\cachemedic_pp_harness\\empty_dirs_for_codex\\src\\cachemedicpp\\sweep.py --sweep_config configs/recovery_vonly_lambda5_tuned_single.yaml --out_root empty_dirs_for_codex/outputs/runs_recovery",
  "config_path": "E:/Research/cachemedic_pp_harness_v1_1/cachemedic_pp_harness/empty_dirs_for_codex/outputs/runs_recovery/recovery_vonly_lambda5_tuned_single/main_contr_vonly_tuned_loto_overwrite_lambda5/sweep_resolved_config.yaml",
  "config_hash": "f873b0c27d8ae7fa9e0b51c584a45df4742ce07f9e8570e75268898681385515",
  "git": {
    "commit": "bd6c9ac08f6d3eab117a86ab644c4066fbc1ae11",
    "dirty": true
  },
  "env": {
    "python": "3.12.10",
    "torch": "2.9.1+cu128",
    "transformers": "4.57.3",
    "cuda": "12.8",
    "gpu_name": "NVIDIA RTX PRO 6000 Blackwell Workstation Edition"
  }
}
