{
  "run_id": "second_model_gpt2_large_vonly_tuned",
  "created_utc": "2026-02-16T17:07:54+00:00",
  "command": "E:\\Research\\cachemedic_pp_harness_v1_1\\cachemedic_pp_harness\\empty_dirs_for_codex\\src\\cachemedicpp\\sweep.py --sweep_config configs/recovery_second_model_gpt2_large_v1.yaml --out_root empty_dirs_for_codex/outputs/runs_recovery --resume",
  "config_path": "E:/Research/cachemedic_pp_harness_v1_1/cachemedic_pp_harness/empty_dirs_for_codex/outputs/runs_recovery/recovery_second_model_gpt2_large_v1/second_model_gpt2_large_vonly_tuned/sweep_resolved_config.yaml",
  "config_hash": "978f3a7eef291bd9729cf44703f31f6c97ea02a9f9a6469d168632d305e4a564",
  "git": {
    "commit": "unknown",
    "dirty": false
  },
  "env": {
    "python": "3.12.10",
    "torch": "2.9.1+cu128",
    "transformers": "4.57.3",
    "cuda": "12.8",
    "gpu_name": "NVIDIA RTX PRO 6000 Blackwell Workstation Edition"
  }
}
