{
  "run_id": "ablation_no_contr_vonly_tuned_loto_overwrite",
  "created_utc": "2026-02-16T17:54:22+00:00",
  "command": "E:\\Research\\cachemedic_pp_harness_v1_1\\cachemedic_pp_harness\\empty_dirs_for_codex\\src\\cachemedicpp\\sweep.py --sweep_config configs/recovery_vonly_tuned_no_contr_run.yaml --out_root empty_dirs_for_codex/outputs/runs_recovery --resume",
  "config_path": "E:/Research/cachemedic_pp_harness_v1_1/cachemedic_pp_harness/empty_dirs_for_codex/outputs/runs_recovery/recovery_vonly_sweep_v1/ablation_no_contr_vonly_tuned_loto_overwrite/sweep_resolved_config.yaml",
  "config_hash": "bbf00004c9c85f76f50b881f8317a3ec6bd843654219cf8db5b2f22f8a5bdd65",
  "git": {
    "commit": "unknown",
    "dirty": false
  },
  "env": {
    "python": "3.12.10",
    "torch": "2.9.1+cu128",
    "transformers": "4.57.3",
    "cuda": "12.8",
    "gpu_name": "NVIDIA RTX PRO 6000 Blackwell Workstation Edition"
  }
}
