{
  "run_id": "mve_gpu_20260215_121245",
  "created_utc": "2026-02-15T11:12:57+00:00",
  "command": "E:\\Research\\cachemedic_pp_harness_v1_1\\cachemedic_pp_harness\\empty_dirs_for_codex\\src\\cachemedicpp\\train.py --config configs/mve.yaml --run_dir E:\\Research\\cachemedic_pp_harness_v1_1\\cachemedic_pp_harness\\empty_dirs_for_codex\\outputs\\runs\\mve_gpu_20260215_121245",
  "config_path": "E:/Research/cachemedic_pp_harness_v1_1/cachemedic_pp_harness/configs/mve.yaml",
  "config_hash": "0612cbfa646f63114eeaf9e6b147ba5de7fd958ac82249c800f258a93acb3446",
  "git": {
    "commit": "unknown",
    "dirty": false
  },
  "env": {
    "python": "3.12.10",
    "torch": "2.9.1+cu128",
    "transformers": "4.57.3",
    "cuda": "12.8",
    "gpu_name": "NVIDIA RTX PRO 6000 Blackwell Workstation Edition"
  }
}
